<?xml version="1.0" encoding="UTF-8"?>
<xs:schema xmlns:xs="http://www.w3.org/2001/XMLSchema">
<xs:import namespace="http://www.w3.org/XML/1998/namespace"/>
<xs:include schemaLocation="langtag.xsd"/>
    <xs:element name="iri" type="xs:string"/>
    <xs:element name="developerName" type="LangTag"/>
    <xs:element name="years_of_experience" type="xs:integer"/>
    <xs:element name="Developer">
        <xs:complexType>
            <xs:sequence>
                <xs:element ref="iri"/>
                <xs:element ref="developerName" minOccurs="0"/>
                <xs:element ref="years_of_experience" minOccurs="0"/>
            </xs:sequence>
        </xs:complexType>
    </xs:element>
    <xs:element name="Developers">
    <xs:complexType>
      <xs:sequence>
        <xs:element ref="Developer" minOccurs="0" maxOccurs="unbounded"/>
      </xs:sequence>
    </xs:complexType>
  </xs:element>
</xs:schema>